{
  "actor": {
    "id": 17925951,
    "login": "fyremael",
    "repository_admin": true
  },
  "api_version": "2026-03-10",
  "assembled_at_utc": "2026-08-04T06:44:09.945823Z",
  "authority": {
    "campaign_issue": "grandchallenge/gcl-standards#22",
    "evidence_issue": "grandchallenge/QUANTUM-TECHNOLOGIES#22",
    "owner_controls_issue": "grandchallenge/QUANTUM-TECHNOLOGIES#21",
    "profile_merge": "5ec22de5d18e02ba91b47f74f23c7acde6bc3ddc",
    "remediation_issue": "grandchallenge/QUANTUM-TECHNOLOGIES#14",
    "surfaces_merge": "cc89ec99493e5ecc2fa54cd5a4698dae0aa2e606",
    "workflow_merge": "260f469ba7349350c2b192a0e066a24aa670d611"
  },
  "boundaries": {
    "deployment_manufacturing_product_or_commercial_authority": false,
    "deviation_disposition_changed": false,
    "hardware_validated": false,
    "mathematics_certified": false,
    "quantum_advantage_proved": false,
    "repository_or_organization_conformance_claimed": false
  },
  "evidence_operation_id": "GCL-GHOS-QUANTUM-OWNER-CONTROLS-EVIDENCE-001",
  "execution_record_model": "owner_timeline_plus_subreceipts_plus_fresh_readback",
  "execution_timeline": {
    "immutable_release_tags_comment": 5175275055,
    "protected_main_ruleset_comment": 5175015034,
    "repository_merge_settings_comment": 5174919919,
    "security_controls_comment": 5175342427
  },
  "operation_id": "GCL-GHOS-QUANTUM-OWNER-CONTROLS-001",
  "repository": "grandchallenge/QUANTUM-TECHNOLOGIES",
  "schema_version": "1.0.0",
  "source_evidence": {
    "immutable_release_tags": {
      "path": "governance/settings-readback/evidence/source/GCL-GHOS-QUANTUM-OWNER-CONTROLS-001.immutable-release-tags.receipt.json",
      "recorded_at_utc": "2026-08-04T06:08:43.5893609Z",
      "ruleset_id": 20355165,
      "sha256": "abb9380aa64387ae45c1078d9bc7612814c51a40968d7d204fc56ada50719067"
    },
    "protected_main_readback": {
      "path": "governance/settings-readback/evidence/source/GCL-GHOS-QUANTUM-OWNER-CONTROLS-001.protected-main-readback.json",
      "protected_main": "260f469ba7349350c2b192a0e066a24aa670d611",
      "recorded_at_utc": "2026-08-04T06:36:29.2997592Z",
      "ruleset_id": 20106953,
      "sha256": "eb7894acb4de2e63134d8c5684c7073a3e5670b0fa21194f4bd3bd6ae15dbba4"
    },
    "security_controls": {
      "codeql_run_id": 30883403446,
      "path": "governance/settings-readback/evidence/source/GCL-GHOS-QUANTUM-OWNER-CONTROLS-001.security-controls.receipt.json",
      "recorded_at_utc": "2026-08-04T06:17:01.7964860Z",
      "sha256": "318f527bfae3826f4b37cc7b50b1e28dbb89aaa43aead40ec40512a6606e7272"
    }
  },
  "target_state": {
    "codeql_validation": {
      "conclusion": "success",
      "head_sha": "260f469ba7349350c2b192a0e066a24aa670d611",
      "jobs": [
        {
          "conclusion": "success",
          "id": 91909321755,
          "name": "Analyze (actions)"
        },
        {
          "conclusion": "success",
          "id": 91909321786,
          "name": "Analyze (python)"
        }
      ],
      "run_id": 30883403446,
      "status": "completed"
    },
    "immutable_release_tag_ruleset": {
      "bypass_actor_count": 0,
      "enforcement": "active",
      "id": 20355165,
      "name": "Immutable release tags",
      "ref_exclude": [],
      "ref_include": [
        "refs/tags/*"
      ],
      "rule_types": [
        "deletion",
        "non_fast_forward"
      ],
      "target": "tag"
    },
    "protected_main": "260f469ba7349350c2b192a0e066a24aa670d611",
    "protected_main_ruleset": {
      "allowed_merge_methods": [
        "merge",
        "squash"
      ],
      "bypass_actor_count": 0,
      "dismiss_stale_reviews_on_push": true,
      "enforcement": "active",
      "id": 20106953,
      "name": "branch_protect",
      "ref_exclude": [],
      "ref_include": [
        "~DEFAULT_BRANCH"
      ],
      "require_code_owner_review": false,
      "require_last_push_approval": false,
      "required_approving_review_count": 0,
      "required_review_thread_resolution": true,
      "required_status_checks": [
        "policy",
        "security / action-policy",
        "validate"
      ],
      "rule_types": [
        "deletion",
        "non_fast_forward",
        "pull_request",
        "required_status_checks"
      ],
      "strict_required_status_checks_policy": true,
      "target": "branch"
    },
    "repository_settings": {
      "allow_auto_merge": true,
      "allow_merge_commit": true,
      "allow_rebase_merge": false,
      "allow_squash_merge": true,
      "allow_update_branch": false,
      "delete_branch_on_merge": true
    },
    "security_controls": {
      "codeql_languages": [
        "actions",
        "python"
      ],
      "codeql_query_suite": "extended",
      "codeql_runner_type": "standard",
      "codeql_schedule": "weekly",
      "codeql_state": "configured",
      "codeql_threat_model": "remote",
      "dependabot_security_updates_enabled": true,
      "dependabot_security_updates_paused": false,
      "private_vulnerability_reporting_enabled": true,
      "vulnerability_alerts_and_dependency_graph_enabled": true
    }
  },
  "validation": {
    "claim_boundaries_closed": true,
    "codeql_validation_run": true,
    "credential_scan": true,
    "immutable_release_tags": true,
    "protected_main_ruleset": true,
    "repository_merge_settings": true,
    "security_controls": true,
    "source_evidence_digests": true
  }
}
